{
  "id": "ror-cli-tools",
  "version": "1.0.0",
  "name": "Room of Requirement CLI Tools",
  "description": "Essential CLI tools installed via Homebrew: kubectl, helm, k9s, jq, yq, gh, and more. Requires Homebrew to be installed first.",
  "documentationURL": "https://github.com/joshyorko/room-of-requirement",
  "licenseURL": "https://github.com/joshyorko/room-of-requirement/blob/main/LICENSE",
  "dependsOn": {},
  "options": {
    "installBrewfile": {
      "type": "boolean",
      "description": "Install CLI tools from Brewfile (default or from workspace)",
      "default": true
    }
  }
}
