{
    "id": "wolfi-docker-dind",
    "version": "1.0.0",
    "name": "Docker-in-Docker (Wolfi)",
    "documentationURL": "https://github.com/joshyorko/room-of-requirement",
    "description": "Docker-in-Docker support for Wolfi-based containers. Uses native Wolfi apk packages instead of Debian/Ubuntu repos.",
    "options": {
        "installBuildx": {
            "type": "boolean",
            "default": true,
            "description": "Install Docker Buildx plugin"
        },
        "installCompose": {
            "type": "boolean",
            "default": true,
            "description": "Install Docker Compose"
        }
    },
    "entrypoint": "/usr/local/share/docker-init.sh",
    "privileged": true,
    "containerEnv": {
        "DOCKER_BUILDKIT": "1"
    },
    "customizations": {
        "vscode": {
            "extensions": [
                "ms-azuretools.vscode-containers"
            ]
        }
    },
    "mounts": [
        {
            "source": "dind-var-lib-docker-${devcontainerId}",
            "target": "/var/lib/docker",
            "type": "volume"
        }
    ]
}
